hash,time,message,buggy
c8260af,2017-01-23T13:34:51,Possible uninitialized variable in USER-DPD/pair_exp6_rx.cpp bugfix.,0.0
31976d1,2017-01-23T19:20:05,skip list definition was missing NP_HALFFULL flag,0.0
b5cb74b,2017-01-23T19:21:48,skip list build is compatible with NP_GHOST,0.0
73177d6,2017-01-25T11:18:03,Fixing GPU memory issue in domain_kokkos,1.0
26c8d3d,2017-01-25T12:53:55,Fixing GPU memory issue in fix_langevin_kokkos,1.0
6328beb,2017-01-25T15:22:42,fix double-return warning,1.0
effbe18,2017-01-25T15:24:01,fix domain boundary indexing,1.0
3d40b51,2017-01-25T15:24:52,remove unused variable,0.0
60b48c9,2017-01-25T15:36:24,add missing KOKKOS_INLINE_FUNCTION attributes,0.0
1074c67,2017-01-25T15:37:27,add missing return keywords,0.0
053ee54,2017-01-25T15:38:41,remove unused variable,0.0
e992bfe,2017-01-25T15:40:52,remove unused variable,0.0
03c9c46,2017-01-25T15:49:05,add missing KOKKOS_INLINE_FUNCTION attributes,0.0
672bbbe,2017-01-25T16:03:11,add more missing KOKKOS_INLINE_FUNCTION attributes,0.0
cfe818a,2017-01-26T08:37:56,remove unused variables from fix_cmap,0.0
f0a4ed6,2017-01-26T08:46:03,add missing KOKKOS_INLINE_FUNCTION for params,0.0
6a74a81,2017-01-26T08:46:28,consistent #ifdefs for fft3d variable,0.0
cf95ea0,2017-01-26T08:50:18,fft3d: only declare variables when used,0.0
5b18421,2017-01-26T08:54:59,fft3d : remove unused variables,0.0
5b29515,2017-01-26T08:57:12,fft3d: use C++ loop declarations,0.0
2023fa2,2017-01-26T10:03:54,consistent #ifdefs for fft3d variable (2),0.0
b5d622c,2017-01-26T10:18:45,pppm_kokkos: remove unused variables,0.0
9daf7fb,2017-01-26T10:19:06,pppm_kokkos: don't shadow member variables,0.0
e5d0bde,2017-01-26T10:19:44,pppm_kokkos: remove useless statement,0.0
a5ff354,2017-01-26T13:45:45,Merge pull request #351 from timattox/USER-DPD_pair_exp6_bugfix,0.0
868d95f,2017-01-26T13:47:12,Merge pull request #352 from akohlmey/fix-skip-with-ghost-issue,0.0
5971d4c,2017-01-26T13:49:56,Merge pull request #358 from ibaned/warnings,0.0
851f804,2017-01-26T13:50:13,Merge pull request #361 from akohlmey/user-omp-fix-per-atom-data,0.0
18e5584,2017-01-26T13:51:47,Merge pull request #354 from stanmoore1/kokkos_bugfixes,0.0
f8506fe,2017-01-26T14:06:43,sync GHub with SVN,0.0
8b7bd9d,2017-01-26T14:59:10,fix bug where per atom data for USER-OMP was reducing the wrong arrays with hybrid styles,1.0
149f37e,2017-01-26T19:08:59,Corrected reference to Fig.1,0.0
09fc8b0,2017-01-27T08:21:57,kspace & dihedral can't do their own sync/modify,0.0
2a6f5e6,2017-01-27T09:17:48,more preference of datamask over custom sync,0.0
5afd3e9,2017-01-27T14:18:01,Adding support to npair_kokkos for triclinic-newton-on neighborlists,0.0
579cc6d,2017-01-27T15:13:37,More tweaks to npair_kokkos for triclinic,0.0
59f4a77,2017-01-27T15:17:39,Whitespace change to npair_kokkos,0.0
51a0b6b,2017-01-28T07:49:08,Fix data type of molecule array in npair_kokkos.h,1.0
033b07f,2017-01-30T07:26:49,Merge pull request #363 from ibaned/obey-datamask,0.0
997142a,2017-01-30T07:27:02,Merge pull request #364 from stanmoore1/kk_triclinic_neighlist,0.0
ed0a347,2017-01-30T10:31:50,Merge branch 'master' into user-cgdna,0.0
9ef55fe,2017-01-31T17:23:51,Merge branch 'kokkos_lammps_bigbig_fix' of https://github.com/rbberger/lammps into tagint-issue,0.0
fbe30b5,2017-01-31T18:13:44,correct issue with compiling for -DLAMMPS_BIGBIG in fix qeq/reax/kk,0.0
bcb1d94,2017-01-31T18:28:04,silence compiler warning about dead code,0.0
67bed8e,2017-01-31T18:34:35,Merge pull request #1 from akohlmey/tagint-issue,0.0
7ee45ec,2017-02-01T11:52:27,Fixing tagint and imageint issues in Kokkos package,1.0
ed59193,2017-02-01T17:39:06,Removed traces of pair morse/kk,0.0
6232073.0,2017-02-01T17:39:37,Removed traces of pair morse/kk,0.0
d4c9e25,2017-02-01T17:45:21,Ported Morse to KOKKOS,0.0
9d1991b,2017-02-02T08:10:23,remove support for obsolete legacy FFT libraries and point -DFFT_FFTW to FFTW3,0.0
6bcec9c,2017-02-02T08:57:21,Merge pull request #2 from stanmoore1/kk_tag_bugfixes,0.0
6595fde,2017-02-02T11:58:12,explain in more detail the handling of error checking for numerical inputs,0.0
daf9f95,2017-02-02T13:09:52,Fixing Kokkos per-atom e/v issue,1.0
38e0e4b,2017-02-02T13:24:05,Add missing typedef in Kokkos pair styles,0.0
6f92429,2017-02-02T13:34:27,Fixing per-atom ev issue,1.0
5da0d39,2017-02-02T13:35:51,Fixing fdotr in pair_buck_coul_cut_kokkos,1.0
0a87b74,2017-02-02T13:42:47,Updated contributing authors and docs,0.0
6a4918b,2017-02-02T13:43:21,Fixing typo in pair_buck_coul_cut_kokkos,1.0
1834a5e,2017-02-02T14:58:04,Fixing more Kokkos per-atom and fdotr issues,1.0
067119f,2017-02-02T15:13:51,Adding missing friend statement to pair_lj_class2_coul_cut_kokkos,0.0
dc34a32,2017-02-03T14:43:12,Merge pull request #362 from ibaned/warnings2,0.0
6ca3774,2017-02-03T14:43:33,Merge pull request #366 from rbberger/kokkos_lammps_bigbig_fix,0.0
84c5171,2017-02-03T14:45:07,Merge pull request #368 from Pakketeretet2/kokkos_morse,0.0
207adc3,2017-02-03T14:45:31,Merge pull request #373 from stanmoore1/kk_more_bugfixes,0.0
191453e,2017-02-03T16:53:10,Merge branch 'master' into fft-cleanup,0.0
27aca14,2017-02-04T15:02:08,Updated polarizer.py to use coul/long/cs,0.0
a5f830c,2017-02-08T14:31:11,fix typo,0.0
8c074a3,2017-02-08T14:32:44,Merge branch 'master' into small-updates-and-fixes,0.0
0efd209,2017-02-09T11:50:03,Merge branch 'master' into user-cgdna,0.0
fbb24c2,2017-02-10T09:22:22,Merge pull request #374 from agiliopadua/master,0.0
02b0e6c,2017-02-10T09:23:51,Merge pull request #375 from akohlmey/small-updates-and-fixes,0.0
0068ef5,2017-02-10T09:25:32,added molecule option to compute group/group command,0.0
2bdda8f,2017-02-13T08:40:54,patch 12Feb17 - change int to tagint for compute group/group,0.0
4843296.0,2017-02-13T08:53:13,Merge pull request #372 from akohlmey/fft-cleanup,0.0
cb982f2,2017-02-13T09:05:03,sync 13Feb17 patch back to GH,0.0
383da81,2017-02-13T10:50:34,Updating Kokkos lib,0.0
8f9b2ac,2017-02-13T10:53:51,Removing unused files in Kokkos lib,0.0
33af7ab,2017-02-13T10:59:22,Remove merge line,0.0
90e5ae9,2017-02-13T11:19:46,Add missing flags to Kokkos Makefile,0.0
15008c9,2017-02-13T13:00:12,USER-DPD: performance optimizations to ssa_update() in fix_shardlow Overall improvements range from 2% to 18% on our benchmarks 1) Newton has to be turned on for SSA  so remove those conditionals 2) Rework the math in ssa_update() to eliminate many ops and temporaries 3) Split ssa_update() into two versions  based on DPD vs. DPDE 4) Reorder code in ssa_update_*() to reduce register pressure,0.0
1b3f6e2,2017-02-13T17:14:52,In PairAIREBO::bondorderLJ only compute torsion term once.,0.0
0e16dc3,2017-02-13T17:37:39,In PairAIREBO::bondorderLJ: p^sigma pi account for d/drij derivatives.,0.0
de4af6f,2017-02-13T17:52:41,In PairAIREBO::bondorderLJ correct omega sum d/drij.,0.0
a323ca1,2017-02-13T18:05:36,Moved variable declarations to front for consistency,0.0
20806dd,2017-02-14T00:26:55,Fixed bugs with pppm/gpu when used with compute group/group,1.0
0fb8dac,2017-02-14T07:41:05,one more Finchham to Fincham change,0.0
4807001.0,2017-02-14T07:42:36,update names in example  too,0.0
6b92347,2017-02-14T13:14:22,updated documentation and examples for coreshell,0.0
928947d,2017-02-15T11:43:50,neighbor_kokkos.cpp: Don't call grow() on neighbor lists that are copies. This corresponds to a bugfix from commit 9161bd98 on neighbor.cpp,0.0
69a8e19,2017-02-15T12:29:52,Add files from Ray Shan for Kokkos version of class2 angle  bond  etc.,0.0
c6c1852,2017-02-15T12:44:54,Fix a few issues with Kokkos class2 files,1.0
ccaec31,2017-02-15T13:00:33,Updating docs for Kokkos class2,0.0
5f93fad,2017-02-15T13:56:16,Add copymode protection to class2 styles,0.0
fc3505f,2017-02-15T16:37:29,Fixed a number of issues after verifying against the KIM version,1.0
904609a,2017-02-15T16:38:13,Fixed issue with switching function derivative in PairAIREBO::FLJ,1.0
4a80df3,2017-02-15T16:45:33,more neighbor list changes  some new options,0.0
ce20c7f,2017-02-17T12:42:07,remove debug code,0.0
a88136c,2017-02-17T17:58:24,correct a logic bug in fix wall/gran/region,0.0
1cd4c48,2017-02-21T15:49:21,new SNAP potential for W,0.0
7185ec9,2017-02-21T15:49:50,Merge pull request #377 from stanmoore1/kokkos_update,0.0
cb9d42d,2017-02-21T15:50:07,Merge pull request #378 from timattox/USER-DPD_ssa_update,0.0
d001a09,2017-02-21T15:50:28,Merge pull request #379 from ndtrung81/pppm-gpu-compute-group-group,0.0
429264a,2017-02-21T15:50:53,Merge pull request #380 from hheenen/core_shell_documentation,0.0
1d17cae,2017-02-21T15:51:35,Merge pull request #382 from timattox/master_kokkos_neigh_bugfix,0.0
b70c670,2017-02-21T15:52:10,Merge pull request #383 from stanmoore1/rshan_class2_kk,0.0
3dbbea3,2017-02-21T15:57:03,remove a debug print line,0.0
53f3df5,2017-02-21T15:57:23,Merge pull request #384 from lammps/another_neigh_refactor,0.0
6e89ccd,2017-02-21T15:59:06,Merge pull request #385 from akohlmey/collected-small-bugfixes,0.0
49e83b4,2017-02-21T16:07:26,patch 21Feb17 sync with GHub,1.0
20a9ffe,2017-02-21T21:27:34,improve consistency and resolve dead links for USER-CGDNA related doc files,0.0
458b674,2017-02-22T20:03:41,Corrected comment in 3' to 5' directionality check.,0.0
3626496.0,2017-02-22T20:06:49,Corrected comment in 3' to 5' directionality check,0.0
a18b4ef,2017-02-24T15:33:13,update AGNI potential for Al  reference runs and output and citation,0.0
9999f36,2017-02-24T15:34:59,remove outdated log files  too.,0.0
2708c86,2017-02-27T18:03:18,fix typos: moleclue -> molecule,0.0
c0cf50b,2017-02-27T18:19:59,trigger recomputing ichunk between runs unless requested otherwise,0.0
b921b69,2017-02-27T18:22:21,implement bugfix from issue #388,1.0
9b01949,2017-02-28T11:05:40,make the introduction of the command-by-category list less confusing,0.0
3605208.0,2017-02-28T11:16:27,add a few more missing details for integrating pair style kolmogorov/crespi/z,0.0
3ac74a1,2017-02-28T11:21:18,update lammps.book file for latest doc changes,0.0
7a593c2,2017-02-28T14:25:03,USER-DPD: correct off-by-one errors in PairTableRX::coeff(),0.0
a1b40b9,2017-02-28T14:59:13,Added Kolmogorov-Crespi potential,0.0
df13a7a,2017-02-28T15:12:35,email added,0.0
323570c,2017-02-28T15:39:01,added jpg for kolmogorov-crespi-z equations and fixed hybrid/overlay check in source,0.0
1dc78a7,2017-02-28T17:45:21,USER-DPD: correct off-by-one errors in PairMultiLucyRX::coeff(),0.0
9a560b9,2017-03-01T15:22:28,USER-DPD bugfix: make atom_vec_dpd work properly with atom_vec_hybrid. We were sending too much data during pack_comm_hybrid/unpack_comm_hybrid.,0.0
8a0e44d,2017-03-01T16:13:44,updated documentation and ev_tally,0.0
eaf7ed7,2017-03-02T21:25:27,Print error if pair_write does not get correct number of arguments,0.0
ce1a3f2,2017-03-03T08:11:55,Merge branch 'pair_write_fix' of https://github.com/andeplane/lammps into small-bugfixes,0.0
6382d3c,2017-03-03T09:14:47,Improving memory access in comm_kokkos,0.0
763a00e,2017-03-03T09:29:17,USER-DPD: pair_multi_lucy_rx bugfix for systems with multiple atom types,0.0
fd78486,2017-03-05T18:27:38,First batch of spelling fixes in manual,0.0
e261bef,2017-03-05T18:30:39,Spelling fixes in source files,0.0
084d831,2017-03-05T20:03:53,Second batch of spelling fixes in manual,0.0
7dd60f9,2017-03-05T20:35:52,Fix typos in src files,0.0
778a79b,2017-03-05T20:39:04,Fix typos in examples folder,0.0
dd76ac5,2017-03-05T20:40:45,Fix typos in tools folder,0.0
17486a9,2017-03-05T21:16:21,Convert USER/lb/polymer files to UNIX line endings and remove trailing whitespace,0.0
fc9eebb,2017-03-05T21:23:41,Added spellcheck utility to documentation build,0.0
3270886.0,2017-03-07T00:27:35,Add remaining false positives,0.0
007f3c6,2017-03-07T00:51:31,Third batch of spelling fixes in manual,0.0
3a054d1,2017-03-07T00:55:01,Fix more typos in src files,0.0
d680040,2017-03-07T00:57:23,Fix more typos in examples,0.0
21be86c,2017-03-07T00:58:03,Fix typos in txt2html,0.0
359af41,2017-03-07T00:58:35,Fix typo in python README,0.0
08baaa9,2017-03-07T01:00:25,Fix more typos in tools,0.0
efaa4c6,2017-03-07T09:31:12,new neigh_modify exclude option  other SNAP changes,0.0
d6866f1,2017-03-07T09:32:30,Merge pull request #376 from v0i0/airebo-bondorderLJ-fixes,0.0
020e75e,2017-03-07T09:33:14,Merge pull request #386 from akohlmey/doc-consistentcy,0.0
798885.0,2017-03-07T09:35:31,Merge pull request #389 from akohlmey/update-agni-potential,0.0
4af6557,2017-03-07T09:46:08,Merge pull request #394 from jaapkroe/kolmogorov-crespi,0.0
e4aa735,2017-03-07T09:46:40,Merge pull request #395 from timattox/USER-DPD_bugfix,0.0
c2aabde,2017-03-07T09:46:54,Merge pull request #398 from stanmoore1/kokkos_changes,0.0
920641b,2017-03-07T09:47:22,Merge pull request #399 from rbberger/docs_spelling_fixes,0.0
a2fa6ef,2017-03-07T09:56:03,Merge pull request #393 from akohlmey/small-bugfixes,0.0
79b005d,2017-03-07T11:40:07,patch 7Mar17,1.0
42d3a8f,2017-03-07T15:41:06,"Fix spelling ""correction"" from 3a054d1a: iterations not interactions. :-)",0.0
683023d,2017-03-08T12:36:23,Adding alloc flag to ev_setup,0.0
1f6c194,2017-03-08T12:42:44,Disable allocation of per-atom arrays in ev_setup for Kokkos styles,0.0
2ef713e,2017-03-08T16:40:16,restore incorrect change due to spell checking in fix imd,0.0
a001a5c,2017-03-09T12:20:49,Fixing memory overflow issue in comm_kokkos,1.0
b28b84d,2017-03-09T14:00:27,Fix half from full nlist issue with Kokkos,1.0
65964f3,2017-03-09T16:40:56,Add error check to lammps_gather_atoms/lammps_scatter_atoms in library.cpp,0.0
5fe6206,2017-03-10T09:16:58,Update Colvars module to version 2017-03-10,0.0
0b4adaa,2017-03-10T09:24:46,Backport typo fixes that were not previously pushed to the Colvars repository,0.0
b20d95d,2017-03-10T10:59:43,Merge pull request #402 from timattox/USER-DPD_spelling,0.0
c97feaf,2017-03-10T11:00:30,Merge pull request #407 from frobnitzem/master,0.0
07fcfd6,2017-03-10T11:01:51,Merge pull request #405 from stanmoore1/ev_setup_kk,0.0
ffe02d2,2017-03-10T14:51:04,Merge pull request #406 from stanmoore1/kokkos_bugfix,0.0
470353e,2017-03-10T14:51:16,Merge pull request #408 from giacomofiorin/colvars-update-2017-03-10,0.0
f871ecd,2017-03-10T15:55:07,change to RCB cuts in load-balancing commands  also a new option for fix halt,0.0
f70752c,2017-03-10T15:58:35,Include PDF of Colvars doc missing in previous commit,0.0
4cfe623,2017-03-10T21:30:03,Correct a typo in the fix_halt.txt documentation.,0.0
27b1c33,2017-03-14T10:39:06,updated the NEMD discussion in the how-to documentation about flow/gauss,0.0
580f6b5,2017-03-14T10:44:31,Add neigh/qeq option to Kokkos,0.0
23b8287,2017-03-14T11:36:44,Updated documentation and simple setup tool,0.0
7a75cd1,2017-03-14T11:39:09,Minor updates in documentation and setup tool  merge before upgrade to oxDNA2,0.0
fdc390a,2017-03-14T14:08:14,Tweaking docs for Kokkos package,0.0
ec1778b,2017-03-15T11:10:04,add pair_zhou,0.0
c3ce374,2017-03-15T11:34:01,Added fix filter/corotate.,1.0
f9468f4,2017-03-15T13:10:58,Merge pull request #412 from timattox/master_typofix,0.0
4c77838,2017-03-15T13:11:26,Merge pull request #414 from sstrong99/flow-gauss-doc-addition,0.0
b1c5912,2017-03-15T13:12:08,Merge pull request #415 from stanmoore1/kk_qeq,0.0
3a2da51,2017-03-15T13:12:43,Merge pull request #413 from ohenrich/user-cgdna,0.0
0d8f74f,2017-03-15T18:54:41,Merge branch 'filter_corotate' of https://github.com/lukin17/lammps into pull-416,0.0
0262a54,2017-03-15T21:56:39,Fix Python 3 compatibility by encoding strings passed as c_char_p,1.0
a210867,2017-03-15T22:13:06,Fixes lammps_create_atoms library function and its Python interface variant,1.0
79cae51,2017-03-15T22:20:30,Document property 'uses_exceptions' of Python interface,0.0
29550d4,2017-03-15T22:31:14,Fix dump cfg in viz_atomeye.py example,1.0
eb29ef3,2017-03-15T22:43:00,Fix space/tab error in pizza/gl.py,1.0
36da922,2017-03-15T22:55:51,Fix dump cfg in vizplotgui_atomeye.py example,1.0
ef940d2,2017-03-16T01:38:05,Improve Python 3 compatibility of pizza tools and simplify read_snapshot code,0.0
cda8213,2017-03-16T01:41:28,Added Python matplotlib plot example,0.0
bdb7669,2017-03-16T09:44:07,Fixed coding style.,0.0
2f5e711,2017-03-16T10:00:12,Merge remote-tracking branch 'upstream/master' into filter_corotate,0.0
db0281b,2017-03-16T12:14:09,Merge branch 'filter_corotate' of https://github.com/lukin17/lammps into pull-416,0.0
1995f43,2017-03-16T14:24:28,fix some more code formatting issues  add newline at EOF,0.0
bed2883,2017-03-16T15:02:50,simplify and shorten examples for fix filter/corotate and combine into a single folder,0.0
f604f86,2017-03-16T15:08:17,add fix filter/corotate to some administrative files,1.0
070ce33,2017-03-16T18:35:04,improve memory usage reporting in info and output class,0.0
efb2a94,2017-03-16T21:51:14,Add utility to detect duplicate anchors in documentation files,0.0
f893104,2017-03-16T22:21:55,Add anchor_check to doc Makefile,0.0
1bb9c7d,2017-03-16T22:36:13,Remove some duplicate anchors in documentation,0.0
621d7d5,2017-03-16T23:05:03,Correct off-by-one error in line number reported,1.0
ac82d04,2017-03-16T23:12:49,ignore package pair style,0.0
411c069,2017-03-17T02:36:41,BUGFIX: Prevent possible deadlock in Irregular::create_atom and create_data,1.0
8e75616,2017-03-17T02:55:41,In irregular.cpp use simpler and slightly faster MPI_Reduce_scatter_block(),0.0
d31c591,2017-03-17T09:40:39,Remove unneeded restart_peratom flags,0.0
a91b851,2017-03-17T11:14:59,Merge pull request #416 from lukin17/filter_corotate,0.0
a936b7b,2017-03-17T11:16:58,Merge pull request #419 from rbberger/python_fixes,0.0
53a3877,2017-03-17T11:17:28,Merge pull request #420 from rbberger/doc_anchor_check,0.0
fcc3b3b,2017-03-17T11:18:08,Merge pull request #421 from akohlmey/memory-output,0.0
7ca5dce,2017-03-17T11:18:52,Merge pull request #423 from timattox/master_bugfix_irregular,0.0
9f35b76,2017-03-17T11:19:04,Merge pull request #424 from timattox/dpd_restart_fix,0.0
4a90bca,2017-03-17T11:29:23,patch 17Mar17,1.0
7fb741d,2017-03-17T11:35:59,"Revert ""In irregular.cpp use simpler and slightly faster MPI_Reduce_scatter_block()""",0.0
ae5ebf6,2017-03-17T11:40:09,add support for MPI_Request_free() to MPI STUBS library,0.0
5be32f5,2017-03-18T20:48:49,remove pair_zhou from Makefile.list,0.0
da81531,2017-03-18T20:54:12,move pair_zhou to USER-MISC and update USER-MISC/README,0.0
2ab77ca,2017-03-18T21:01:40,adapt to LAMMPS coding style,0.0
d04ea86,2017-03-18T21:21:25,add examples for pair_zhou,0.0
b6ecfb9,2017-03-18T21:22:02,deleted pair_zhou in main/src (moved to USER-MISC),0.0
52987a3,2017-03-18T22:32:39,Started writing pair_zhou.txt,0.0
d496c0f,2017-03-20T08:57:29,Merge pull request #426 from dstelter92/master,0.0
5b842f0,2017-03-20T09:15:48,Teff and exchange bugfix  as per Greg Dignon to match python examples,1.0
5c39dfd,2017-03-20T09:22:09,re-ran example with fixed exchanges,0.0
554531a,2017-03-20T13:51:36,update permissions,0.0
f0c6ed0,2017-03-20T16:24:38,remove xmovie,0.0
ecf1762,2017-03-20T16:25:06,more permission fixes,0.0
0a6b33c,2017-03-20T16:27:00,remove duplicate paragraph in nose-hoover fix docs,0.0
2218a9d,2017-03-20T16:32:04,emphasize that the online manual is following the latest development version,0.0
0d0c2b6,2017-03-20T16:32:16,correct stan's email address,0.0
3b44c3f,2017-03-20T16:55:14,remove non-ASCII characters from doc source files,0.0
03828b5,2017-03-20T16:57:32,adapt binary2txt.cpp source to current coding conventions,0.0
a42b0b7,2017-03-20T17:04:16,update colvars abf integrate tool from git repo,0.0
e110d69,2017-03-20T17:17:35,remove obsolete tools and files,0.0
47d6451,2017-03-20T17:18:24,fix compilation for pymol_asphere tool,1.0
82d952a,2017-03-20T17:26:19,mention NumPy dependency instead of Numeric for python tools,0.0
0c9cd11,2017-03-20T18:25:11,have the relevant LAMMPS version embedded into top part of the html manual,0.0
6482df6,2017-03-20T18:57:30,remove references to deleted tools. update/clarify section on restart2data,0.0
145e682,2017-03-21T08:18:21,Merge pull request #427 from akohlmey/small-updates-and-corrections,0.0
dcede30,2017-03-21T08:56:37,changes for next patch  2d disc options for spheres  fix external upgrade  bug fixes for fix ave/chunk for density calcs  Aidan doc page citation deconvolution,0.0
734e639,2017-03-21T14:12:00,correct typo reported on lammps-users,1.0
c5d561a,2017-03-22T12:00:32,pair_zhou docs: add equation  add link in section_commands and pairs,0.0
43f2725,2017-03-22T14:05:16,Merge branch 'add-pair-zhou' of https://github.com/tonnamb/lammps into pull-417,0.0
cb90596,2017-03-22T14:39:46,a few more small changes to integrate pair style zhou properly,0.0
3ec16f3,2017-03-22T14:40:30,fully integrate support for doc_anchor_check into docs makefile,0.0
1275970.0,2017-03-22T14:57:37,Cleanup of a few more references to obsoleted and removed tools like xmovie,0.0
a14d582,2017-03-22T15:00:57,correct inconsistent anchors,1.0
a79aef6,2017-03-22T15:00:57,correct inconsistent anchors,1.0
66eb9c2,2017-03-22T15:01:11,remove reference to removed section on VMD scripts,0.0
43a304f,2017-03-22T15:01:11,remove reference to removed section on VMD scripts,0.0
dc1d93a,2017-03-22T15:08:09,some more whitespace cleanup,0.0
ef3f323,2017-03-22T15:12:43,"Revert ""remove reference to removed section on VMD scripts""",0.0
3070b04,2017-03-22T15:12:47,"Revert ""correct inconsistent anchors""",0.0
1db5834,2017-03-22T15:12:49,"Revert ""Cleanup of a few more references to obsoleted and removed tools like xmovie""",0.0
1ea9a14,2017-03-22T15:55:34,Add Tonnam and Ya names,0.0
daae76c,2017-03-22T15:59:00,Add names Tonnam and Ya to README,0.0
7435084.0,2017-03-22T15:59:10,Verified oxDNA with modified nucleotide layout,0.0
af0b5b0,2017-03-22T16:23:29,Removed dead code,0.0
bf560e7,2017-03-22T16:56:40,edit description and add related commands and default,0.0
6d395ec,2017-03-23T10:08:47,change name zhou to momb in docs  fix grammar,0.0
1075be7,2017-03-23T10:18:15,rename zhou to momb in examples,0.0
df8dbec,2017-03-23T10:22:49,rename pair_zhou to pair_momb in src and change class name from PairZhou to PairMomb,0.0
343c9ed,2017-03-23T10:24:13,change zhou to momb in src/USER-MISC/README,0.0
02e6590,2017-03-23T11:03:00,add example log file generated from 17Nov16 version of lammps  make minimize and run short in system.in,0.0
b88a749,2017-03-23T11:38:33,rename a couple more references to pair style zhou into momb,0.0
865b41e,2017-03-23T11:50:10,make pair style momb example follow LAMMPS conventions more closely,0.0
568b67e,2017-03-23T12:00:53,include citation for reference paper into pair style momb,0.0
9ecc5c8,2017-03-23T14:12:37,Merge branch 'fix-airebo-morse' of https://github.com/v0i0/lammps into pull-431,0.0
5c9892c,2017-03-23T14:14:49,apply airebo/m bugfix also to USER-OMP version,0.0
a72efbe,2017-03-23T15:18:23,whitespace cleanup,0.0
47cade2,2017-03-23T15:19:02,re-arranged functions to make it easier to compare with non-threaded. port bugfixes to airebo to USER-OMP,0.0
44841f6,2017-03-23T15:31:27,fix ave/chunk fixes  2d disc option  fix_modify dynamic/dof,1.0
2cdcd6d,2017-03-23T16:03:25,remove one more reference to xmovie,0.0
f127e42,2017-03-23T17:37:49,Fix airebo/morse,1.0
47cebb0,2017-03-23T17:43:27,And getting it right...,0.0
8820315.0,2017-03-23T17:57:02,Merge branch 'master' into updates-for-stable,0.0
277b93c,2017-03-24T09:41:30,Merge pull request #417 from tonnamb/add-pair-zhou,0.0
f5a85d6,2017-03-24T10:01:23,Merge pull request #429 from akohlmey/updates-for-stable,0.0
e6fcaef,2017-03-24T10:03:29,Merge pull request #431 from v0i0/fix-airebo-morse,0.0
394e9b4,2017-03-24T13:53:07,new CHARMM pair styles with force swithing/shifting,0.0
3dfe450,2017-03-24T15:17:51,24Mar17 patch sync with SVN,0.0
04fd038,2017-03-27T13:46:57,Fixed a bug with equal-style variables as manifold params.,1.0
3feffbe,2017-03-27T13:49:53,Removed diagnostics.,0.0
c041727,2017-03-27T14:28:50,remove dead code and reduce trivial compiler warnings (clang++),0.0
87ea9ba,2017-03-27T14:29:13,bugfix for library interface,1.0
da90967,2017-03-27T14:30:21,update .gitignore for newly added files,0.0
61e7595,2017-03-27T14:59:58,remove references to xmovie  streamline dump and viz descriptions,0.0
a241b2d,2017-03-27T15:00:19,fix problems with references,1.0
5feeb79,2017-03-27T15:16:28,one more line of dead code removed,0.0
443ea13,2017-03-28T02:05:05,add image flag packing/unpacking to library/python interface,0.0
fc51c38,2017-03-28T02:22:45,add some docs for the special treatment of image flags,0.0
28bdebd,2017-03-28T07:50:48,avoid segfault when calling PPPM*::memory_usage() before grid communication is initialized,0.0
f8da9a8,2017-03-28T11:00:22,synchronize dump custom/vtk documentation with that of dump custom,0.0
ee55a98,2017-03-28T11:22:10,Changed the check on initial and final temperature to <= 0 for both.,0.0
1dfd61f,2017-03-28T12:33:45,Merge pull request #432 from Pakketeretet2/user_manifold_fix,0.0
111d350,2017-03-28T12:34:46,fix gcmc units change for chemical potential,1.0
61f3ff1,2017-03-28T12:35:33,Merge branch 'master' of github.com:lammps/lammps,0.0
7e9f05b,2017-03-28T12:49:09,Merge pull request #433 from akohlmey/fixes-for-stable,0.0
80e5111,2017-03-28T12:50:13,Merge pull request #434 from akohlmey/imgflags-in-library,0.0
645f56c,2017-03-28T12:51:17,Merge pull request #436 from Pakketeretet2/better_incorrect_input_handling_nh,0.0
9f6e126,2017-03-28T12:52:26,Merge pull request #437 from ohenrich/user-cgdna,0.0
0637f23,2017-03-28T13:12:23,patch 28Mar17,1.0
4b9d0a9,2017-03-28T13:26:12,sync with SVN,0.0
ef6070c,2017-03-28T14:35:58,remove executable permissions for potential files,0.0
1d8f0c7,2017-03-28T14:37:30,Merge branch 'master' into fixes-for-stable,0.0
8afed61,2017-03-28T18:16:36,Upgrade to oxDNA2,0.0
604afeb,2017-03-28T18:22:02,Update to oxDNA2,0.0
66a6375,2017-03-28T18:58:31,Resolved merge conflict,0.0
5c1f546,2017-03-28T19:08:24,Removed contribution line from header files,0.0
1544b51,2017-03-29T01:18:24,Support mixed Python use by honoring Python GIL,0.0
c733204,2017-03-29T08:28:03,Updated lammps.book and install script,0.0
